{
  "inode": 1180417,
  "exists": true,
  "kind": "tech",
  "producer": "linux-farm",
  "version": 1,
  "hash": "9f2b1c0a4e7d8b30",
  "tech": {
    "container": "mov",
    "duration_ms": 12480,
    "size_bytes": 880000000,
    "video": { "codec": "hevc", "width": 3840, "height": 2160, "fps": 23.976, "pix_fmt": "yuv422p10le", "bit_depth": 10, "color_primaries": "bt2020", "transfer": "arib-std-b67", "matrix": "bt2020nc", "hdr": "hlg", "log_format": null, "timecode": "01:00:00:00" },
    "audio": [ { "codec": "pcm_s24le", "channels": 2, "sample_rate": 48000, "bit_depth": 24, "language": null } ]
  }
}
